{
  "$schema": "http://json-schema.org/draft-07/schema#",
  "$id": "https://rest-api-template.dev/schemas/ai-loop/v1/state",
  "title": "AI Loop State Schema",
  "description": "Schema for tracking AI coding task state through the verification workflow",
  "type": "object",
  "properties": {
    "taskId": {
      "type": "string",
      "description": "Unique identifier for the task (UUID or format: task-YYYYMMDD-hhmmss)",
      "pattern": "^task-[0-9]{8}-[0-9]{6}$"
    },
    "title": {
      "type": "string",
      "description": "Short title describing the task",
      "minLength": 1,
      "maxLength": 100
    },
    "description": {
      "type": "string",
      "description": "Detailed description of the task and its requirements",
      "minLength": 1
    },
    "status": {
      "type": "string",
      "description": "Current state of the task in the workflow",
      "enum": ["not_started", "planning", "implementation", "verification", "completed", "abandoned"],
      "default": "not_started"
    },
    "baseCommit": {
      "type": "string",
      "description": "Git commit SHA that serves as the baseline for changes",
      "pattern": "^[a-f0-9]{40}$"
    },
    "targetBranch": {
      "type": "string",
      "description": "Branch where changes will be committed",
      "minLength": 1
    },
    "filesModified": {
      "type": "array",
      "description": "List of files that have been modified during this task",
      "items": {
        "type": "string",
        "pattern": "^\\S+$"
      },
      "default": []
    },
    "filesCreated": {
      "type": "array",
      "description": "List of files that have been created during this task",
      "items": {
        "type": "string",
        "pattern": "^\\S+$"
      },
      "default": []
    },
    "filesDeleted": {
      "type": "array",
      "description": "List of files that have been deleted during this task",
      "items": {
        "type": "string",
        "pattern": "^\\S+$"
      },
      "default": []
    },
    "verifiedTests": {
      "type": "boolean",
      "description": "Whether matching tests have been added or updated",
      "default": false
    },
    "verifiedDocs": {
      "type": "boolean",
      "description": "Whether documentation has been updated to match code changes",
      "default": false
    },
    "verifiedNeutrality": {
      "type": "boolean",
      "description": "Whether files pass neutrality checks (no AI markers, no IDE metadata)",
      "default": false
    },
    "verifiedNoDuplication": {
      "type": "boolean",
      "description": "Whether no new duplication has been introduced",
      "default": false
    },
    "retryAttempts": {
      "type": "object",
      "description": "Retry attempt tracking (primary implementation tracked separately via primaryImplementationStatus)",
      "properties": {
        "primaryImplementationAttempt": {
          "type": "integer",
          "description": "Count of PRIMARY_IMPLEMENTATION_ATTEMPT executions (0 = not started, 1 = executed; not a retry, tracked separately)",
          "minimum": 0,
          "maximum": 1,
          "default": 0
        },
        "correctiveAttempt": {
          "type": "integer",
          "description": "Count of CORRECTIVE_ATTEMPT retries",
          "minimum": 0,
          "maximum": 1,
          "default": 0
        },
        "transientRetry": {
          "type": "integer",
          "description": "Count of TRANSIENT_RETRY retries for the current operation",
          "minimum": 0,
          "maximum": 2,
          "default": 0
        },
        "flakyTestRerun": {
          "type": "integer",
          "description": "Count of FLAKY_TEST_RERUN reruns for the current test",
          "minimum": 0,
          "maximum": 1,
          "default": 0
        }
      },
      "default": {
        "primaryImplementationAttempt": 0,
        "correctiveAttempt": 0,
        "transientRetry": 0,
        "flakyTestRerun": 0
      }
    },
    "lastRetryType": {
      "type": ["string", "null"],
      "description": "Type of the last retry operation (null if primary implementation or no retries)",
      "enum": ["CORRECTIVE_ATTEMPT", "TRANSIENT_RETRY", "FLAKY_TEST_RERUN", null],
      "default": null
    },
    "lastRetryReason": {
      "type": "string",
      "description": "Description of why the last retry occurred",
      "default": ""
    },
    "retryLimitsExceeded": {
      "type": "array",
      "description": "List of retry types for which limits have been exceeded (requires human approval). Primary implementation exceeding 1 is a plan revision need, tracked separately.",
      "items": {
        "type": "string",
        "enum": ["CORRECTIVE_ATTEMPT", "TRANSIENT_RETRY", "FLAKY_TEST_RERUN"]
      },
      "default": []
    },
    "primaryImplementationStatus": {
      "type": "string",
      "description": "Status of primary implementation attempt (separate from retries)",
      "enum": ["not_started", "in_progress", "completed", "failed"],
      "default": "not_started"
    },
    "primaryImplementationFailureReason": {
      "type": "string",
      "description": "Reason for primary implementation failure (if status is 'failed')",
      "default": ""
    },
    "verifierRejection": {
      "type": "boolean",
      "description": "Whether a verifier has rejected the result (no automatic retries allowed)",
      "default": false
    },
    "verifierRejectionReason": {
      "type": "string",
      "description": "Reason for verifier rejection",
      "default": ""
    },
    "createdAt": {
      "type": "string",
      "description": "ISO 8601 timestamp when the task state was created",
      "format": "date-time"
    },
    "updatedAt": {
      "type": "string",
      "description": "ISO 8601 timestamp when the task state was last updated",
      "format": "date-time"
    },
    "metadata": {
      "type": "object",
      "description": "Additional metadata for the task",
      "properties": {
        "initiator": {
          "type": "string",
          "description": "Name of the person or system that initiated the task"
        },
        "priority": {
          "type": "string",
          "enum": ["low", "medium", "high", "critical"],
          "default": "medium"
        },
        "relatedTasks": {
          "type": "array",
          "items": {
            "type": "string"
          },
          "default": []
        }
      },
      "additionalProperties": true
    }
  },
  "required": ["taskId", "title", "description", "status", "baseCommit", "targetBranch", "createdAt", "updatedAt"],
  "additionalProperties": true
}
