{
    "taskId":  "task-20260909-090000",
    "title":  "Verify all handler transactions with JUnit 6",
    "description":  "Exercise all five enhanced handler methods against PostgreSQL: commit, rollback after persistence, cascade atomicity, declared read-only scope with active transaction lifecycle, and cleanup.",
    "status":  "completed",
    "baseCommit":  "3720b054feadb50c6178b70f54d329ee2fc32ac6",
    "targetBranch":  "feature/ai-task-20260909-handler-transactions",
    "filesModified":  [
                          "README.md",
                          "docs/architecture.md"
                      ],
    "filesCreated":  [
                         "src/test/java/rest/api/HandlerTransactionTestSupport.java",
                         "src/test/java/rest/api/genre/GenreHandlerTransactionTest.java",
                         "src/test/java/rest/api/member/MemberHandlerTransactionTest.java"
                     ],
    "filesDeleted":  [

                     ],
    "verifiedTests":  true,
    "verifiedDocs":  true,
    "verifiedNeutrality":  true,
    "verifiedNoDuplication":  true,
    "retryAttempts":  {
                          "primaryImplementationAttempt":  1,
                          "correctiveAttempt":  1,
                          "transientRetry":  0,
                          "flakyTestRerun":  0
                      },
    "lastRetryReason":  "Targeted test compilation showed DB.endTransaction() is absent from Ebean 17. Replaced it with null-guarded current Transaction.end() and reused shared cleanup.",
    "retryLimitsExceeded":  [

                            ],
    "primaryImplementationStatus":  "completed",
    "primaryImplementationFailureReason":  "",
    "verifierRejection":  false,
    "verifierRejectionReason":  "",
    "createdAt":  "2026-09-09T09:00:00Z",
    "updatedAt":  "2026-09-10T04:06:00Z",
    "metadata":  {
                     "initiator":  "user",
                     "priority":  "medium",
                     "planRevisionApprovedAt":  "2026-09-10T04:00:00Z",
                     "planRevision":  "Verify readOnly=true on handler annotations and verify active/closed runtime transaction lifecycle.",
                     "relatedTasks":  [

                                      ]
                 },
    "lastRetryType":  "CORRECTIVE_ATTEMPT"
}
