{
    "taskId":  "task-20260910-174827",
    "title":  "Audit project consistency and duplication",
    "description":  "Audit relevant source, tests, configuration, scripts, and canonical documentation for inconsistencies and duplication, then apply minimal corrections.",
    "status":  "completed",
    "baseCommit":  "5b16768588024303ba222f53aff99ab0e219f135",
    "targetBranch":  "feature/ai-task-20260910-project-consistency-audit",
    "filesModified":  [
                          ".agents/skills/repo-ai-loop/SKILL.md",
                          ".agents/skills/repo-harness/SKILL.md",
                          ".agents/skills/repo-loops/SKILL.md",
                          ".github/pull_request_template.md",
                          ".gitignore",
                          ".token-ignore",
                          "AGENTS.md",
                          "HARNESS.md",
                          "LOOP.md",
                          "README.md",
                          "docs/architecture-standards.md",
                          "docs/architecture.md",
                          "docs/index.md",
                          "llms.txt",
                          "openapi.yaml",
                          "opencode.json",
                          "pom.xml",
                          "scripts/validate-ai-loop.ps1",
                          "scripts/validate-ai-loop.sh",
                          "src/main/java/rest/api/API.java",
                          "src/main/java/rest/api/ContextHelpers.java",
                          "src/main/java/rest/api/ExceptionHandlers.java",
                          "src/main/java/rest/api/PagedData.java",
                          "src/main/java/rest/api/PagedSearch.java",
                          "src/main/java/rest/api/RequestLogger.java",
                          "src/main/java/rest/api/SecureToken.java",
                          "src/main/java/rest/api/TemplateEngines.java",
                          "src/main/java/rest/api/Validators.java",
                          "src/main/java/rest/api/XSRFFilter.java",
                          "src/main/java/rest/api/XSRFToken.java",
                          "src/main/java/rest/api/genre/GenreHandler.java",
                          "src/main/java/rest/api/genre/GenreService.java",
                          "src/main/java/rest/api/member/DMember.java",
                          "src/main/java/rest/api/member/DPhone.java",
                          "src/main/java/rest/api/member/MemberHandler.java",
                          "src/main/java/rest/api/member/MemberService.java",
                          "src/main/java/rest/api/member/MemberToAdd.java",
                          "src/main/resources/i18n_ja.properties",
                          "src/test/java/rest/api/AuthorizationTest.java",
                          "src/test/java/rest/api/ContextHelpersTest.java",
                          "src/test/java/rest/api/HandlerTransactionTestSupport.java",
                          "src/test/java/rest/api/MailTest.java",
                          "src/test/java/rest/api/PagedSearchTest.java",
                          "src/test/java/rest/api/RequestLoggerTest.java",
                          "src/test/java/rest/api/SecureTokenTest.java",
                          "src/test/java/rest/api/XSRFTokenTest.java",
                          "src/test/java/rest/api/genre/DGenreTest.java",
                          "src/test/java/rest/api/genre/GenreHandlerTest.java",
                          "src/test/java/rest/api/genre/GenreHandlerTransactionTest.java",
                          "src/test/java/rest/api/member/MemberHandlerTest.java",
                          "src/test/java/rest/api/member/MemberHandlerTransactionTest.java",
                          "src/test/java/rest/api/member/MemberServiceTest.java",
                          "src/test/resources/i18n_ja.properties",
                          "src/test/resources/i18nTest_ja.properties"
                      ],
    "filesCreated":  [
                         ".ai-loop/schema/state.schema.json",
                         ".ai-loop/schema/verification.schema.json",
                         ".ai-loop/templates/plan.template.md",
                         ".ai-loop/templates/state.template.json",
                         ".ai-loop/templates/verification.template.json",
                         ".ai-loop/tasks/task-20260909-090000/plan.md",
                         ".ai-loop/tasks/task-20260909-090000/state.json",
                         ".ai-loop/tasks/task-20260909-090000/verification.json",
                         ".ai-loop/tasks/task-20260910-164758/plan.md",
                         ".ai-loop/tasks/task-20260910-164758/state.json",
                         ".ai-loop/tasks/task-20260910-164758/verification.json",
                         ".ai-loop/tasks/task-20260910-174827/plan.md",
                         ".ai-loop/tasks/task-20260910-174827/state.json",
                         ".ai-loop/tasks/task-20260910-174827/verification.json",
                         "src/main/java/rest/api/TimedToken.java",
                         "src/test/java/rest/api/APIBehaviorTest.java",
                         "src/test/java/rest/api/XSRFFilterTest.java"
                     ],
    "filesDeleted":  [

                     ],
    "verifiedTests":  true,
    "verifiedDocs":  true,
    "verifiedNeutrality":  true,
    "verifiedNoDuplication":  true,
    "retryAttempts":  {
                          "primaryImplementationAttempt":  1,
                          "correctiveAttempt":  1,
                          "transientRetry":  0,
                          "flakyTestRerun":  0
                      },
    "lastRetryType":  "CORRECTIVE_ATTEMPT",
    "lastRetryReason":  "One corrective pass aligned stale Mockito expectations, fixture lengths, and utility-method visibility with the refactored contracts found by targeted compilation and tests.",
    "retryLimitsExceeded":  [

                            ],
    "primaryImplementationStatus":  "completed",
    "primaryImplementationFailureReason":  "",
    "verifierRejection":  false,
    "verifierRejectionReason":  "",
    "createdAt":  "2026-09-10T09:48:27Z",
    "updatedAt":  "2026-09-11T01:19:15Z",
    "metadata":  {
                     "initiator":  "user",
                     "priority":  "high",
                     "relatedTasks":  [
                                          "task-20260910-164758"
                                      ]
                 }
}
