{
  "taskId": "task-20260911-095555",
  "title": "Rename API entry point to Server",
  "description": "Rename rest.api.API to rest.api.Server and align source, tests, build configuration, and documentation.",
  "status": "completed",
  "baseCommit": "5b16768588024303ba222f53aff99ab0e219f135",
  "targetBranch": "feature/ai-task-20260910-project-consistency-audit",
  "filesModified": [
    "AGENTS.md",
    "docs/architecture.md",
    "docs/architecture-standards.md",
    "llms.txt",
    "pom.xml",
    "src/main/java/rest/api/Mail.java",
    "src/main/java/rest/api/RequestLogger.java",
    "src/main/java/rest/api/SecureToken.java",
    "src/main/java/rest/api/TemplateEngines.java",
    "src/main/java/rest/api/TimedToken.java",
    "src/main/java/rest/api/XSRFFilter.java",
    "src/main/java/rest/api/XSRFToken.java",
    "src/test/java/rest/api/AuthorizationTest.java",
    "src/test/java/rest/api/CryptoTest.java",
    "src/test/java/rest/api/SecureTokenTest.java",
    "src/test/java/rest/api/genre/GenreHandlerTest.java",
    "src/test/java/rest/api/member/MemberHandlerTest.java"
  ],
  "filesCreated": [
    ".ai-loop/tasks/task-20260911-095555/plan.md",
    ".ai-loop/tasks/task-20260911-095555/state.json",
    ".ai-loop/tasks/task-20260911-095555/verification.json",
    "src/main/java/rest/api/Server.java",
    "src/test/java/rest/api/ServerBehaviorTest.java"
  ],
  "filesDeleted": [
    "src/main/java/rest/api/API.java",
    "src/test/java/rest/api/APIBehaviorTest.java"
  ],
  "verifiedTests": true,
  "verifiedDocs": true,
  "verifiedNeutrality": true,
  "verifiedNoDuplication": true,
  "retryAttempts": {
    "primaryImplementationAttempt": 1,
    "correctiveAttempt": 0,
    "transientRetry": 0,
    "flakyTestRerun": 0
  },
  "lastRetryType": null,
  "lastRetryReason": "",
  "retryLimitsExceeded": [],
  "primaryImplementationStatus": "completed",
  "primaryImplementationFailureReason": "",
  "verifierRejection": false,
  "verifierRejectionReason": "",
  "createdAt": "2026-09-11T01:55:55Z",
  "updatedAt": "2026-09-11T02:02:20Z",
  "metadata": {
    "initiator": "user",
    "priority": "medium",
    "relatedTasks": ["task-20260910-174827"]
  }
}
